{
    "schema_version": "1.0.0",
    "mode": "range-safe",
    "project_root": "@PROJECT_ROOT@",
    "declared_constraint": null,
    "allowed_minors": [
        "8.2",
        "8.3",
        "8.4",
        "8.5"
    ],
    "feature_ceiling": "8.2",
    "lifecycle_ceiling": "8.5",
    "platform_override": null,
    "observed_runtime": null,
    "coverage": {
        "status": "unknown",
        "known_min": "8.2",
        "known_max": "8.5",
        "open_upper_bound": false
    },
    "confidence": "unresolved",
    "sources": [
        {
            "type": "composer.require.php",
            "path": null,
            "value": null
        }
    ],
    "warnings": [
        "policy.no_php_constraint_declared: No PHP constraint could be determined for this project (composer.json is missing, or declares no require.php); the policy falls back to every PHP minor known to this tool (8.2-8.5) with unresolved confidence."
    ]
}
