{
    "schema_version": "1.0.0",
    "mode": "single-target",
    "project_root": "@PROJECT_ROOT@",
    "declared_constraint": "^8.2",
    "allowed_minors": [
        "8.2"
    ],
    "feature_ceiling": "8.2",
    "lifecycle_ceiling": "8.2",
    "platform_override": null,
    "observed_runtime": null,
    "coverage": {
        "status": "coverage_gap",
        "known_min": "8.2",
        "known_max": "8.5",
        "open_upper_bound": true
    },
    "confidence": "declared",
    "sources": [
        {
            "type": "composer.require.php",
            "path": "composer.json",
            "value": "^8.2"
        }
    ],
    "warnings": [
        "coverage.open_upper_bound_bounded: The constraint \"^8.2\" allows PHP minors newer than 8.5, which this tool does not know. Lifecycle guidance stops at 8.5.",
        "mode.single_target_narrowed: single-target mode narrowed 4 allowed minors (8.2, 8.3, 8.4, 8.5) to the lowest, 8.2. Both ceilings collapse to 8.2, so lifecycle guidance is narrowed too: deprecations and removals that only take effect on the dropped minors are reported as applicable rather than as deprecations. This is the mode's semantics, not a two-axis collapse. Use --php to choose a different target explicitly."
    ]
}
